[
  {
    "date": "2026-08-19",
    "day_number": 1,
    "user_input": "体重：55.8 体脂率：28.5%\n血压：122/80 68\n运动：晨起拉伸15分钟\n饮食：早饭 燕麦粥+水煮蛋；午饭 杂粮饭+清炒青菜；晚饭 蒸南瓜+豆腐\nbed_time：23:00\nwake_time：06:30\n睡眠：7分\n基础体温：36.4\n今天膝盖有点僵硬，活动后缓解。",
    "feedback": {
      "hot": "第1天，记录得很完整。",
      "cold": [
        "55.80 kg 是序列起点，单日不形成趋势。",
        "膝盖僵硬先记录，观察是否反复出现。"
      ]
    }
  },
  {
    "date": "2026-08-20",
    "day_number": 2,
    "user_input": "体重：55.6 体脂率：28.3%\n血压：120/78 66\n运动：散步40分钟\n饮食：早饭 全麦面包+牛奶；午饭 鸡胸肉沙拉；晚饭 红薯+蔬菜汤\nbed_time：22:40\nwake_time：06:20\n睡眠：8分\n基础体温：36.5\n情绪平稳，膝盖无不适。",
    "feedback": {
      "hot": "今天状态不错。",
      "cold": [
        "睡眠8分属于良好，保持作息节奏。",
        "继续记录体重与血压的连续值。"
      ]
    }
  },
  {
    "date": "2026-08-21",
    "day_number": 3,
    "user_input": "体重：55.7 体脂率：28.4%\n血压：124/82 70\n运动：核心训练20分钟\n饮食：早饭 杂粮馒头+豆浆；午饭 糙米饭+番茄炒蛋；晚饭 蔬菜拌面\nbed_time：23:20\nwake_time：06:40\n睡眠：6分\n基础体温：36.6\n昨晚入睡困难，醒来两次。情绪有点烦躁。",
    "feedback": {
      "hot": "把入睡困难和情绪波动都记下来了。",
      "cold": [
        "睡眠6分偏低，留意咖啡因和睡前屏幕。",
        "烦躁与睡眠不足可能共同出现，继续观察。"
      ]
    }
  },
  {
    "date": "2026-08-22",
    "day_number": 4,
    "user_input": "体重：55.5 体脂率：28.2%\n血压：118/76 64\n运动：瑜伽30分钟\n饮食：早饭 小米粥+鸡蛋；午饭 藜麦饭+清蒸鱼；晚饭 蔬菜豆腐汤\nbed_time：22:30\nwake_time：06:10\n睡眠：8分\n基础体温：36.5\n经期开始，经量偏少。",
    "feedback": {
      "hot": "经期第一天已记录。",
      "cold": [
        "记录经期起止与经量，便于看规律。",
        "经期避免剧烈运动，保持轻度活动。"
      ]
    }
  },
  {
    "date": "2026-08-24",
    "day_number": 5,
    "user_input": "体重：55.6 体脂率：28.3%\n血压：121/79 67\n运动：散步30分钟\n饮食：早饭 燕麦+牛奶；午饭 杂粮饭+西兰花；晚饭 蒸蛋+绿叶菜\nbed_time：23:10\nwake_time：06:30\n睡眠：7分\n基础体温：36.4\n白天出现一次潮热，持续很短。",
    "feedback": {
      "hot": "潮热出现的时间和次数都记下来了。",
      "cold": [
        "单次潮热不能下结论，继续记录频率。",
        "留意潮热与情绪、睡眠的共同出现。"
      ]
    }
  },
  {
    "date": "2026-08-25",
    "day_number": 6,
    "user_input": "体重：55.4 体脂率：28.1%\n血压：119/77 65\n运动：拉伸15分钟\n饮食：早饭 全麦面包+豆浆；午饭 鸡胸肉+糙米；晚饭 蔬菜汤\nbed_time：22:50\nwake_time：06:15\n睡眠：8分\n基础体温：36.6\n情绪稳定，膝盖偶尔有点不舒服。",
    "feedback": {
      "hot": "今天记录很用心。",
      "cold": [
        "膝盖不适再次出现，留意活动量。",
        "睡眠良好保持作息。"
      ]
    }
  },
  {
    "date": "2026-08-26",
    "day_number": 7,
    "user_input": "体重：55.5 体脂率：28.2%\n血压：123/81 69\n运动：核心训练20分钟\n饮食：早饭 杂粮粥+鸡蛋；午饭 番茄牛肉+米饭；晚饭 凉拌豆腐\nbed_time：23:30\nwake_time：06:50\n睡眠：5分\n基础体温：36.7\n入睡困难，情绪烦躁，夜里醒来两次。",
    "feedback": {
      "hot": "情绪和睡眠的细节都留下来了。",
      "cold": [
        "睡眠5分偏低，调整睡前放松。",
        "烦躁与入睡困难共同出现，继续观察。"
      ]
    }
  },
  {
    "date": "2026-08-27",
    "day_number": 8,
    "user_input": "体重：55.3 体脂率：28.0%\n血压：117/75 63\n运动：散步35分钟\n饮食：早饭 燕麦+牛奶；午饭 杂粮饭+清蒸鱼；晚饭 蒸南瓜+蔬菜\nbed_time：22:40\nwake_time：06:20\n睡眠：8分\n基础体温：36.5\n状态恢复，膝盖正常，没有不适。",
    "feedback": {
      "hot": "今天整体平稳。",
      "cold": [
        "睡眠8分良好，保持节奏。",
        "无不适也值得记录，作为对比基线。"
      ]
    }
  },
  {
    "date": "2026-08-28",
    "day_number": 9,
    "user_input": "体重：55.4 体脂率：28.1%\n血压：120/78 66\n运动：瑜伽30分钟\n饮食：早饭 小米粥+鸡蛋；午饭 藜麦+鸡胸；晚饭 蔬菜豆腐汤\nbed_time：23:00\nwake_time：06:25\n睡眠：7分\n基础体温：36.6\n经期接近结束，经量正常。",
    "feedback": {
      "hot": "经期变化记录完整。",
      "cold": [
        "记录经期结束时间，便于算周期。",
        "经期保持轻度活动与保暖。"
      ]
    }
  },
  {
    "date": "2026-08-29",
    "day_number": 10,
    "user_input": "体重：55.2 体脂率：27.9%\n血压：116/74 62\n运动：散步40分钟\n饮食：早饭 全麦面包+牛奶；午饭 沙拉+糙米；晚饭 红薯+蔬菜汤\nbed_time：22:30\nwake_time：06:00\n睡眠：9分\n基础体温：36.4\n今天心情很好，没有不适。",
    "feedback": {
      "hot": "睡眠9分，状态很好。",
      "cold": [
        "良好睡眠值得保持。",
        "无症状日也记录，形成完整曲线。"
      ]
    }
  },
  {
    "date": "2026-08-30",
    "day_number": 11,
    "user_input": "体重：55.3 体脂率：28.0%\n血压：118/76 64\n运动：核心训练20分钟\n饮食：早饭 杂粮粥+鸡蛋；午饭 番茄炒蛋+米饭；晚饭 凉拌豆腐+绿叶菜\nbed_time：23:10\nwake_time：06:30\n睡眠：6分\n基础体温：36.7\n膝盖有点不舒服，情绪有点烦躁，夜里醒来一次。",
    "feedback": {
      "hot": "不适和情绪都记下来了。",
      "cold": [
        "膝盖与情绪同时出现，留意共同诱因。",
        "睡眠6分偏低，调整睡前放松。"
      ]
    }
  }
]